CARD TYPE	EFFECT	NAME	ATTRIBUTE	LEVEL	TYPE	ATK	DEF	DESCRIPTION	CODE	RELEASE DATE	ORIGINAL RELEASE NAME	ORIGINAL RELEASE TYPE
Monster	Normal	Summoned Skull	DARK	6	Fiend	2500	1200	A fiend with dark powers for confusing the enemy. Among the Fiend-Type monsters, this monster boasts considerable force.	70781052	03/29/2002	Yugi	Starter Deck
Monster	Effect	Swamp Battleguard	EARTH	5	Warrior	1800	1500	This card gains 500 ATK for each "Lava Battleguard" you control.	40453765	06/26/2002	Metal Raiders	Booster Pack
Spell	Equip	Sword of Dark Destruction						A DARK monster equipped with this card increases its ATK by 400 points and decreases its DEF by 200 points.	37120512	03/29/2002	Yugi	Starter Deck
Spell	Equip	Sword of Deep-Seated						The equipped monster gains 500 ATK/DEF. If this card is sent to your GY: Place it on top of your Deck.	98495314	06/26/2002	Metal Raiders	Booster Pack
Spell	Normal	Swords of Revealing Light						After this card's activation, it remains on the field, but destroy it during the End Phase of your opponent's 3rd turn. When this card is activated: If your opponent controls a face-down monster, flip all monsters they control face-up. While this card is face-up on the field, your opponent's monsters cannot declare an attack.	72302403	03/08/2002	Legend of Blue Eyes White Dragon	Booster Pack
Monster	Normal	Swordstalker	DARK	6	Warrior	2000	1600	A monster formed by the vengeful souls of those who passed away in battle.	50005633	03/29/2002	Kaiba	Starter Deck
Monster	Effect	Tainted Wisdom	DARK	3	Fiend	1250	800	If this Attack Position card is changed to face-up Defense Position: Shuffle your Deck.	28725004	06/26/2002	Metal Raiders	Booster Pack
Monster	Normal	Terra the Terrible	DARK	4	Fiend	1200	1300	Known as a swamp dweller, this creature is a minion of the dark forces.	63308047	03/08/2002	Legend of Blue Eyes White Dragon	Booster Pack
Monster	Normal	The 13th Grave	DARK	3	Zombie	1200	900	A zombie that appeared from plot #13 - an empty grave.	00032864	03/08/2002	Legend of Blue Eyes White Dragon	Booster Pack
Monster	Effect	The Bistro Butcher	DARK	4	Fiend	1800	1000	When this card inflicts Battle Damage to your opponent's Life Points, your opponent draws 2 cards from their Deck.	71107816	06/26/2002	Metal Raiders	Booster Pack
Spell	Normal	The Cheerful Coffin						Discard up to 3 Monster Cards from your hand to the Graveyard.	41142615	06/26/2002	Metal Raiders	Booster Pack
Spell	Normal	The Flute of Summoning Dragon						Special Summon up to 2 Dragon monsters from your hand. "Lord of D." must be on the field to activate and to resolve this effect.	43973174	03/29/2002	Kaiba	Starter Deck
Monster	Normal	The Furious Sea King	WATER	3	Aqua	800	700	Grand King of the Seven Seas, he's able to summon massive tidal waves to drown the enemy.	18710707	03/08/2002	Legend of Blue Eyes White Dragon	Booster Pack
Monster	Flip	The Immortal of Thunder	LIGHT	4	Thunder	1500	1300	FLIP: Increase your Life Points by 3000 points. When this card is sent from the field to the Graveyard, you lose 5000 Life Points.	84926738	06/26/2002	Metal Raiders	Booster Pack
Spell	Normal	The Inexperienced Spy						Select and see 1 card in your opponent's hand.	81820689	03/29/2002	Kaiba	Starter Deck
Monster	Effect	The Little Swordsman of Aile	WATER	3	Warrior	800	1300	Offer 1 monster on your side of the field as a Tribute to increase this monster's ATK by 700 points until the end of the turn.	25109950	06/26/2002	Metal Raiders	Booster Pack
Monster	Flip	The Stern Mystic	LIGHT	4	Spellcaster	1500	1200	FLIP: Reveal all face-down cards on the field (Flip Effects are not activated), then return them to their original positions.	87557188	03/29/2002	Yugi	Starter Deck
Monster	Effect	The Unhappy Maiden	LIGHT	1	Spellcaster	0	100	When this card is sent to the Graveyard as a result of battle, the Battle Phase for that turn ends immediately.	51275027	06/26/2002	Metal Raiders	Booster Pack
Monster	Effect	The Wicked Worm Beast	EARTH	3	Beast	1400	700	This face-up card on the field is returned to the owner's hand during the End Phase of your turn.	06285791	03/29/2002	Kaiba	Starter Deck
Monster	Fusion	Thousand Dragon	WIND	7	Dragon	2400	2000	"Time Wizard" + "Baby Dragon"	41462083	06/26/2002	Metal Raiders	Booster Pack
Monster	Effect	Thunder Dragon	LIGHT	5	Thunder	1600	1500	You can discard this card; add up to 2 "Thunder Dragon" from your Deck to your hand.	31786629	06/26/2002	Metal Raiders	Booster Pack
Monster	Effect	Time Wizard	LIGHT	2	Spellcaster	500	400	Once per turn: You can toss a coin and call it. If you call it right, destroy all monsters your opponent controls. If you call it wrong, destroy as many monsters you control as possible, and if you do, take damage equal to half the total ATK those destroyed monsters had while face-up on the field.	71625222	06/26/2002	Metal Raiders	Booster Pack
Monster	Normal	Tongyo	WATER	4	Fish	1350	800	This monster captures other fish with its long tongue and sucks the energy out of them.	69572024	06/26/2002	Metal Raiders	Booster Pack
Trap	Normal	Trap Hole						When your opponent Normal or Flip Summons 1 monster with 1000 or more ATK: Target that monster; destroy that target.	04206964	03/08/2002	Legend of Blue Eyes White Dragon	Booster Pack
Monster	Flip	Trap Master	EARTH	3	Warrior	500	1100	FLIP: Select 1 Trap Card on the field and destroy it. If the selected card is Set, pick up and see the card. If it is a Trap Card, it is destroyed. If it is a Spell Card, return it to its original position.	46461247	03/29/2002	Yugi	Starter Deck
Spell	Normal	Tremendous Fire						Inflict 1000 points of damage to your opponent's Life Points and 500 points of damage to your Life Points.	46918794	06/26/2002	Metal Raiders	Booster Pack
Monster	Normal	Trent	EARTH	5	Plant	1500	1800	A guardian of the woods, this massive tree is believed to be immortal.	78780140	06/26/2002	Metal Raiders	Booster Pack
Monster	Normal	Tri-Horned Dragon	DARK	8	Dragon	2850	2350	An unworthy dragon with three sharp horns sprouting from its head.	39111158	03/08/2002	Legend of Blue Eyes White Dragon	Booster Pack
Monster	Normal	Trial of Nightmare	DARK	4	Fiend	1300	900	This fiend passes judgement on enemies that are locked in coffins.	77827521	03/08/2002	Legend of Blue Eyes White Dragon	Booster Pack
Spell	Normal	Tribute to The Doomed						Discard 1 card, then target 1 monster on the field; destroy it.	79759861	06/26/2002	Metal Raiders	Booster Pack
Monster	Normal	Tripwire Beast	EARTH	4	Thunder	1200	1300	This creature attacks with electromagnetic waves.	45042329	03/08/2002	Legend of Blue Eyes White Dragon	Booster Pack
Monster	Normal	Turtle Tiger	WATER	4	Aqua	1000	1500	A tiger encased in a protective shell that attacks with razor-sharp fangs.	37313348	03/08/2002	Legend of Blue Eyes White Dragon	Booster Pack
Monster	Fusion	Twin-Headed Thunder Dragon	LIGHT	7	Thunder	2800	2100	"Thunder Dragon" + "Thunder Dragon"	54752875	06/26/2002	Metal Raiders	Booster Pack
Monster	Normal	Two-Mouth Darkruler	EARTH	3	Dinosaur	900	700	A dinosaur with two deadly jaws, it stores electricity in its horn and releases high voltage bolts from the mouth on its back.	57305373	03/08/2002	Legend of Blue Eyes White Dragon	Booster Pack
Trap	Normal	Two-Pronged Attack						Select and destroy 2 of your monstera and 1 of your opponent's monsters.	83887306	03/08/2002	Legend of Blue Eyes White Dragon	Booster Pack
Monster	Normal	Tyhone	WIND	4	Winged Beast	1200	1400	Capable of firing cannonballs from its mouth for long-range attacks, this creature is particularly effective in mountain battles.	72842870	03/08/2002	Legend of Blue Eyes White Dragon	Booster Pack
Trap	Continuous	Ultimate Offering						During your Main Phase or your opponent's Battle Phase: You can pay 500 Life Points; immediately after this effect resolves, Normal Summon/Set 1 monster.	80604091	03/29/2002	Yugi	Starter Deck
Spell	Field	Umi						All Fish, Sea Serpent, Thunder, and Aqua monsters on the field gain 200 ATK/DEF, also all Machine and Pyro monsters on the field lose 200 ATK/DEF.	22702055	03/08/2002	Legend of Blue Eyes White Dragon	Booster Pack
Monster	Normal	Unknown Warrior of Fiend	DARK	3	Warrior	1000	500	The speed of this warrior creates an intense vacuum that can slice through a monster's hide.	97360116	03/29/2002	Kaiba	Starter Deck
Monster	Normal	Uraby	EARTH	4	Dinosaur	1500	800	Fast on its feet, this dinosaur rips enemies to shreds with its sharp claws.	01784619	03/08/2002	Legend of Blue Eyes White Dragon	Booster Pack
Spell	Equip	Vile Germs						A Plant-Type monster equipped with this card increases its ATK and DEF by 300 points.	39774685	03/08/2002	Legend of Blue Eyes White Dragon	Booster Pack
Spell	Equip	Violet Crystal						A Zombie-Type monster equipped with this card increases its ATK and DEF by 300 points.	15052462	03/08/2002	Legend of Blue Eyes White Dragon	Booster Pack
Trap	Normal	Waboku						You take no battle damage from your opponent's monsters this turn. Your monsters cannot be destroyed by battle this turn.	12607053	03/29/2002	Yugi	Starter Deck
Monster	Effect	Wall of Illusion	DARK	4	Fiend	1000	1850	If this card is attacked by a monster, after damage calculation: Return that monster to the hand.	13945283	03/29/2002	Yugi	Starter Deck
Spell	Field	Wasteland						All Dinosaur, Zombie, and Rock monsters on the field gain 200 ATK/DEF.	23424603	03/08/2002	Legend of Blue Eyes White Dragon	Booster Pack
Monster	Normal	Water Omotics	WATER	4	Aqua	1400	1200	Transforms the water overflowing from a jar into attacking dragons.	02483611	06/26/2002	Metal Raiders	Booster Pack
Monster	Effect	White Magical Hat	LIGHT	3	Spellcaster	1000	700	When this card inflicts Battle Damage to your opponent's Life Points, your opponent discards 1 card randomly from his/her hand.	15150365	06/26/2002	Metal Raiders	Booster Pack
Monster	Normal	Winged Dragon, Guardian of the Fortress #1	WIND	4	Dragon	1400	1200	A dragon commonly found guarding mountain fortresses. Its signature attack is a sweeping dive from out of the blue.	87796900	03/29/2002	Yugi	Starter Deck
Monster	Effect	Witch of the Black Forest	DARK	4	Spellcaster	1100	1200	If this card is sent from the field to the GY: Add 1 monster with 1500 or less DEF from your Deck to your hand, but you cannot activate cards, or the effects of cards, with that name for the rest of this turn. You can only use this effect of "Witch of the Black Forest" once per turn.	78010363	06/26/2002	Metal Raiders	Booster Pack
Monster	Effect	Witch's Apprentice	DARK	2	Spellcaster	550	500	As long as this card remains face-up on the field, increase the ATK of all DARK monsters by 500 points and decrease the ATK of all LIGHT monsters by 400 points.	80741828	06/26/2002	Metal Raiders	Booster Pack
Monster	Normal	Witty Phantom	DARK	4	Fiend	1400	1300	Dressed in a night-black tuxedo, this creature presides over the darkness.	36304921	03/08/2002	Legend of Blue Eyes White Dragon	Booster Pack
Monster	Effect	Yado Karu	WATER	4	Aqua	900	1700	When this card is changed from Attack Position to Defense Position, you can place any number of cards from your hand at the bottom of your Deck in any order you desire.	29380133	06/26/2002	Metal Raiders	Booster Pack
Spell	Field	Yami						All Fiend and Spellcaster monsters on the field gain 200 ATK/DEF, also all Fairy monsters on the field lose 200 ATK/DEF.	59197169	03/08/2002	Legend of Blue Eyes White Dragon	Booster Pack